OrganisationURI,OrganisationLabel,SiteReference,PreviouslyPartOf,SiteNameAddress,SitePlanURL,CoordinateReferenceSystem,GeoX,GeoY,Hectares,OwnershipStatus,Deliverable,PlanningStatus,PermissionType,PermissionDate,PlanningHistory,ProposedForPIP,MinNetDwellings,DevelopmentDescription,NonHousingDevelopment,Part2,NetDwellingsRangeFrom,NetDwellingsRangeTo,HazardousSubstances,SiteInformation,Notes,FirstAddedDate,LastUpdatedDate
http://opendatacommunities.org/id/unitary-authority/milton-keynes,Milton Keynes Council,BR58,,"""Lawn Farm, Oakhill Lane, Oakhill, Milton Keynes, MK5 6AH""",https://mapping.milton-keynes.gov.uk/mymiltonkeynes.aspx,WGS84,52.016479,-0.810948,0.07,Not owned by a public authority,,Permissioned,Full planning permission,"""2015-03-23""",https://publicaccess2.milton-keynes.gov.uk/online-applications/propertyDetails.do?activeTab=relatedCases&keyVal=0004I300LI000,,9,"""Erection of 9 dwellings""",,,,,,,,"""2017-12-31""","""2017-12-31"""
http://opendatacommunities.org/id/unitary-authority/milton-keynes,Milton Keynes Council,BR59,,"""134 Dunthorne Way, Grange Farm, Milton Keynes""",https://mapping.milton-keynes.gov.uk/mymiltonkeynes.aspx,WGS84,52.0216646,-0.8069904,0.3,Not owned by a public authority,,Permissioned,Full planning permission,"""2016-09-01""",https://publicaccess2.milton-keynes.gov.uk/online-applications/propertyDetails.do?activeTab=relatedCases&keyVal=OB98OOKW0000,,10,"""Prior notification for change of use of first and second floor offices (use class B1a) to 10 x flats""",,,,,,,,"""2017-12-31""","""2017-12-31"""
http://opendatacommunities.org/id/unitary-authority/milton-keynes,Milton Keynes Council,BR60,,"""Skew Bridge Cottage, Drayton Road, Bletchley, Milton Keynes, MK3 5JU""",https://mapping.milton-keynes.gov.uk/mymiltonkeynes.aspx,WGS84,51.972838,-0.730533,0.03,Not owned by a public authority,,Permissioned,Outline planning permission,"""2016-12-01""",https://publicaccess2.milton-keynes.gov.uk/online-applications/propertyDetails.do?activeTab=relatedCases&keyVal=001C9P00LI000,,10,"""Outline application for the demolition of existing dwelling and cessation of groundworks contracting business and the erection of ten dwellings on the site (all matters reserved except access)""",,,,,,,,"""2017-12-31""","""2017-12-31"""
http://opendatacommunities.org/id/unitary-authority/milton-keynes,Milton Keynes Council,BR61,,"""86-96 Queensway, Bletchley, Milton Keynes""",https://mapping.milton-keynes.gov.uk/mymiltonkeynes.aspx,WGS84,51.9942576,-0.7315326,0.39,Not owned by a public authority,,Permissioned,Full planning permission,"""2016-12-22""",https://publicaccess2.milton-keynes.gov.uk/online-applications/propertyDetails.do?activeTab=relatedCases&keyVal=OFS7CRKW0000,,10,"""Notification for prior approval for a proposed change of use from office (use class B1a) to 10 x flats (use class C3)""",,,,,,,,"""2017-12-31""","""2017-12-31"""
http://opendatacommunities.org/id/unitary-authority/milton-keynes,Milton Keynes Council,BR62,,"""18A St Georges Road, Bletchley, Milton Keynes, MK3 5ES""",https://mapping.milton-keynes.gov.uk/mymiltonkeynes.aspx,WGS84,51.9892437,-0.7614305,0.12,Owned by a public authority,,Permissioned,Full planning permission,"""2017-01-13""",https://publicaccess2.milton-keynes.gov.uk/online-applications/propertyDetails.do?activeTab=relatedCases&keyVal=000RX500LI000,,10,"""Demolition of existing buildings and erection of 10 x 2 bedroom apartments and associated works""",,,,,,,,"""2017-12-31""","""2017-12-31"""
http://opendatacommunities.org/id/unitary-authority/milton-keynes,Milton Keynes Council,BR63,,"""Land at 76 to 83 Shearmans, Fullers Slade, Milton Keynes""",https://mapping.milton-keynes.gov.uk/mymiltonkeynes.aspx,WGS84,52.048708,-0.829436,0.2,Not owned by a public authority,,Permissioned,Outline planning permission,"""2016-07-28""",https://publicaccess2.milton-keynes.gov.uk/online-applications/propertyDetails.do?activeTab=relatedCases&keyVal=NFRZGSKW0000,,14,"""Outline planning permission for the erection of 14 x flats over existing retail premises""",,,,,,,,"""2017-12-31""","""2017-12-31"""
http://opendatacommunities.org/id/unitary-authority/milton-keynes,Milton Keynes Council,BR64,,"""Land at Galleon Wharf, Old Wolverton Road, Old Wolverton, Milton Keynes""",https://mapping.milton-keynes.gov.uk/mymiltonkeynes.aspx,WGS84,52.065297,-0.82758,0.44,Not owned by a public authority,,Permissioned,Outline planning permission,"""2017-08-31""",https://publicaccess2.milton-keynes.gov.uk/online-applications/propertyDetails.do?activeTab=relatedCases&keyVal=NWX9B6KW07500,,14,"""Outline application for up to 14 dwellings, pedestrian and vehicular access""",,,,,,,,"""2017-12-31""","""2017-12-31"""
http://opendatacommunities.org/id/unitary-authority/milton-keynes,Milton Keynes Council,BR65,,"""Site B1.1, Grafton Gate, Central Milton Keynes""",https://mapping.milton-keynes.gov.uk/mymiltonkeynes.aspx,WGS84,52.03882,-0.771412,0.13,Not owned by a public authority,,Permissioned,Full planning permission,"""2016-10-27""",https://publicaccess2.milton-keynes.gov.uk/online-applications/propertyDetails.do?activeTab=relatedCases&keyVal=002HRB00LI000,,24,"""Construction of 5 storey building containing 24 x flats, undercroft parking, covered walkway and substation""",,,,,,,,"""2017-12-31""","""2017-12-31"""
http://opendatacommunities.org/id/unitary-authority/milton-keynes,Milton Keynes Council,BR66,,"""Towergate House, 352 Avebury Boulevard, Central Milton Keynes""",https://mapping.milton-keynes.gov.uk/mymiltonkeynes.aspx,WGS84,52.03711,-0.7605511,0.1,Not owned by a public authority,,Permissioned,Full planning permission,"""2017-06-26""",https://publicaccess2.milton-keynes.gov.uk/online-applications/propertyDetails.do?activeTab=relatedCases&keyVal=L4JM2CKW0000,,32,"""Prior notification for change of use from Office (Use Class B1a) to 32 x flats""",,,,,,,,"""2017-12-31""","""2017-12-31"""
http://opendatacommunities.org/id/unitary-authority/milton-keynes,Milton Keynes Council,BR67,,"""Grant Thornton House, 210 Silbury Boulevard, Central Milton Keynes, MK9 1LW""",https://mapping.milton-keynes.gov.uk/mymiltonkeynes.aspx,WGS84,52.0385669,-7686249,0.1,Not owned by a public authority,,Permissioned,Full planning permission,"""2017-02-14""",https://publicaccess2.milton-keynes.gov.uk/online-applications/propertyDetails.do?activeTab=relatedCases&keyVal=KWTWSTKW0000,,35,"""Prior notification for change of use from office (use class B1a) to 35 x flats (use class C3)""",,,,,,,,"""2017-12-31""","""2017-12-31"""
