OrganisationURI,OrganisationLabel,SiteReference,PreviouslyPartOf,SiteNameAddress,SiteplanURL,OSGB36,GeoX,GeoY,Hectares,OwnershipStatus,Deliverable,PlanningStatus,PermissionType,PermissionDate,PlanningHistory,ProposedForPIP,MinNetDwellings,DevelopmentDescription,NonHousingDevelopment,Part2,NetDwellingsRangeFrom,NetDwellingsRangeTo,HazardousSubstances,SiteInformation,Notes,FirstAddedDate,LastUpdatedDate
http://opendatacommunities.org/id/district-council/newcastle-staffs,Newcastle-under-Lyme Borough Council,AB17,,"Former working men's club, New Road, Audley",https://publicaccess.newcastle-staffs.gov.uk/online-applications/applicationDetails.do?activeTab=map&keyVal=NSLI1MBMGW500,OSGB36,380500.04,350966.03,0.33,owned by a public authority,yes,permissioned,full planning permission,2016-05-27,https://publicaccess.newcastle-staffs.gov.uk/online-applications/applicationDetails.do?keyVal=NSLI1MBMGW500&activeTab=summary,,12,Erection of 12 houses,,,,,,,15/0692/FUL,2017-12-18,2017-12-18
http://opendatacommunities.org/id/district-council/newcastle-staffs,Newcastle-under-Lyme Borough Council,BL24,,"Land adjacent 31 Banbury Street, Talke",https://publicaccess.newcastle-staffs.gov.uk/online-applications/applicationDetails.do?activeTab=map&keyVal=MZJMHBBM4V000,OSGB36,382763.99,354225.54,0.27,not owned by a public authority,yes,permissioned,full planning permission,2016-03-14,https://publicaccess.newcastle-staffs.gov.uk/online-applications/applicationDetails.do?activeTab=summary&keyVal=MZJMHBBM4V000,,13,"Erection of 13 new dwellings with associated access road, parking and landscaping",,,,,,,14/00027/FUL ,2017-12-18,2017-12-18
http://opendatacommunities.org/id/district-council/newcastle-staffs,Newcastle-under-Lyme Borough Council,BL25,,"Methodist Church, Chapel Street, Butt Lane",https://publicaccess.newcastle-staffs.gov.uk/online-applications/applicationDetails.do?activeTab=map&keyVal=N3VI2EBM4V000,OSGB36,382709.62,354579.04,0.1,not owned by a public authority,,not permissioned,,,https://publicaccess.newcastle-staffs.gov.uk/online-applications/applicationDetails.do?activeTab=summary&keyVal=N3VI2EBM4V000,,10,,,,,,,,Site lapsed residential planning permission 14/00266/FUL ,2017-12-18,2017-12-18
http://opendatacommunities.org/id/district-council/newcastle-staffs,Newcastle-under-Lyme Borough Council,BL8,,"Land to the south of West Avenue, Kidsgrove",https://publicaccess.newcastle-staffs.gov.uk/online-applications/applicationDetails.do?activeTab=map&keyVal=NNMN7MBMN3F00,OSGB36,382320.75,354379.67,1.41,not owned by a public authority,yes,permissioned,outline planning permission,2016-09-07,https://publicaccess.newcastle-staffs.gov.uk/online-applications/applicationDetails.do?activeTab=summary&keyVal=NNMN7MBMN3F00,,44,"Outline planning application for residential development for 44 dwellings at West Avenue, Kidsgrove (Phase 4) ",,,,,,,15/00368/OUT ,2017-12-18,2017-12-18
http://opendatacommunities.org/id/district-council/newcastle-staffs,Newcastle-under-Lyme Borough Council,CH4,,"Wilmott Drive, Cross Heath, Newcastle-under-Lyme",https://publicaccess.newcastle-staffs.gov.uk/online-applications/applicationDetails.do?activeTab=map&keyVal=ONOB4WBMK6800,OSGB36,383733.27,347403.55,8.7,not owned by a public authority,yes,permissioned,other,,https://publicaccess.newcastle-staffs.gov.uk/online-applications/applicationDetails.do?activeTab=summary&keyVal=ONOB4WBMK6800,,276,"Development of 276 dwellings, public open space and associated infrastructure works",,,,,,,There is a resolution to grant planning permission 17/00281/FUL,2017-12-18,2017-12-18
http://opendatacommunities.org/id/district-council/newcastle-staffs,Newcastle-under-Lyme Borough Council,CT13,,"Heathcote Street, Chesterton (Chesterton Ex-Servicemens Club)",https://www.newcastle-staffs.gov.uk/sites/default/files/IMCE/Planning/Planning_Policy/NonLocal/CT13.pdf,OSGB36,383261.93,349639.24,0.1,not owned by a public authority,,not permissioned,,,https://publicaccess.newcastle-staffs.gov.uk/online-applications/applicationDetails.do?activeTab=summary&keyVal=JKJST1BM03T00,,5,,,,,,,,Part of lapsed mixed use residential permission 07/00620/OUT ,2017-12-18,2017-12-18
http://opendatacommunities.org/id/district-council/newcastle-staffs,Newcastle-under-Lyme Borough Council,CT22,,Ex Servicemens Club Heathcote Street,https://publicaccess.newcastle-staffs.gov.uk/online-applications/applicationDetails.do?activeTab=map&keyVal=OQ3EWWBMH0G00,OSGB36,383301.66,349652.16,0.31,not owned by a public authority,,permissioned,full planning permission,2017-09-28,https://publicaccess.newcastle-staffs.gov.uk/online-applications/applicationDetails.do?activeTab=summary&keyVal=OQ3EWWBMH0G00,,14,Proposed residential development of 14 dwellings,,,,,,,17/00417/FUL,2017-12-18,2017-12-18
http://opendatacommunities.org/id/district-council/newcastle-staffs,Newcastle-under-Lyme Borough Council,CT23,,"Corona Park, Sandford Street, Chesterton",https://publicaccess.newcastle-staffs.gov.uk/online-applications/applicationDetails.do?activeTab=map&keyVal=L7AIQNBM4V000,OSGB36,383316.01,349573.70,0.3,not owned by a public authority,yes,permissioned,full planning permission,2010-12-07,https://publicaccess.newcastle-staffs.gov.uk/online-applications/applicationDetails.do?keyVal=L7AIQNBM4V000&activeTab=summary,,8,Erection of 16 terraced dwellings (Amended Description) ,,,,,,,10/00480/FUL - Development commenced 8 completed.,2017-12-18,2017-12-18
http://opendatacommunities.org/id/district-council/newcastle-staffs,Newcastle-under-Lyme Borough Council,HD18,,"London Road, Chesterton (Bennett Arms)",https://publicaccess.newcastle-staffs.gov.uk/online-applications/applicationDetails.do?activeTab=map&keyVal=KGT5XUBM06A00,OSGB36,383898.49,348500.06,0.15,not owned by a public authority,,not permissioned,,,https://publicaccess.newcastle-staffs.gov.uk/online-applications/applicationDetails.do?keyVal=KGT5XUBM06A00&activeTab=summary,,7,,,,,,,,09/00155/FUL  - lapsed permisison for 7 dwellings ,2017-12-18,2017-12-18
http://opendatacommunities.org/id/district-council/newcastle-staffs,Newcastle-under-Lyme Borough Council,HD25,,"Midland House, London Road, Chesterton",https://publicaccess.newcastle-staffs.gov.uk/online-applications/applicationDetails.do?activeTab=map&keyVal=OAVL23BMIW400,OSGB36,383429.56,348978.90,0.16,not owned by a public authority,yes,permissioned,reserved matters approval,2016-09-19,https://publicaccess.newcastle-staffs.gov.uk/online-applications/applicationDetails.do?activeTab=summary&keyVal=OAVL23BMIW400,,14,Application for approval of the reserved matter of landscaping pursuant to outline planning permission granted on appeal 10th September 2013 for demolition of existing industrial building and erection of 14 dwellings and retail/commercial units ,,,,,,,16/00623/REM ,2017-12-18,2017-12-18
http://opendatacommunities.org/id/district-council/newcastle-staffs,Newcastle-under-Lyme Borough Council,HM3,,"Wrinehill Garage, Main Road, Betley",https://publicaccess.newcastle-staffs.gov.uk/online-applications/applicationDetails.do?activeTab=map&keyVal=J7L744BMX0000,OSGB36,375406.14,346942.86,0.16,not owned by a public authority,,permissioned,full planning permission,2007-01-15,https://publicaccess.newcastle-staffs.gov.uk/online-applications/applicationDetails.do?keyVal=J7L744BMX0000&activeTab=summary,,7,"
7 residential units ",,,,,,,06/00984/FUL,2017-12-18,2017-12-18
http://opendatacommunities.org/id/district-council/newcastle-staffs,Newcastle-under-Lyme Borough Council,KG15,,"Former Garages at Gloucester Road, Kidsgrove",https://publicaccess.newcastle-staffs.gov.uk/online-applications/applicationDetails.do?activeTab=map&keyVal=NGZL58BM01S00,OSGB36,384391.62,355291.53,0.29,owned by a public authority,yes,permissioned,outline planning permission,2015-02-09,https://publicaccess.newcastle-staffs.gov.uk/online-applications/applicationDetails.do?activeTab=summary&keyVal=NGZL58BM01S00,,8,Residential development for up to 8 dwellings ,,,,,,,14/00890/DEEM3 ,2017-12-18,2017-12-18
http://opendatacommunities.org/id/district-council/newcastle-staffs,Newcastle-under-Lyme Borough Council,KG16,,"Lock Up Garages Sussex Drive, Kidsgrove",https://www.newcastle-staffs.gov.uk/sites/default/files/IMCE/Planning/Planning_Policy/NonLocal/KG16.pdf,OSGB36,383911.41,354986.08,0.13,not owned by a public authority,yes,permissioned,outline planning permission,2016-12-02,https://publicaccess.newcastle-staffs.gov.uk/online-applications/applicationDetails.do?activeTab=summary&keyVal=OEOLYOBMIHW00,,6,Demolition of existing lock-up garages and erection of 6 town houses ,,,,,,,16/00852/OUT ,2017-12-18,2017-12-18
http://opendatacommunities.org/id/district-council/newcastle-staffs,Newcastle-under-Lyme Borough Council,KG6,,"William Road, Kidsgrove (site of the Galley PH)",https://publicaccess.newcastle-staffs.gov.uk/online-applications/applicationDetails.do?activeTab=map&keyVal=LRRZTZBM4V000,OSGB36,384185.12,354982.18,0.18,not owned by a public authority,yes,permissioned,full planning permission,2011-12-23,https://publicaccess.newcastle-staffs.gov.uk/online-applications/applicationDetails.do?activeTab=summary&keyVal=LRRZTZBM4V000,,10,Proposed development of 10 new town houses on the site of the former Galley Public House. ,,,,,,,11/00494/FUL ,2017-12-18,2017-12-18
http://opendatacommunities.org/id/district-council/newcastle-staffs,Newcastle-under-Lyme Borough Council,KL17,,"The Hawthorns, Keele (West)",https://publicaccess.newcastle-staffs.gov.uk/online-applications/applicationDetails.do?activeTab=map&keyVal=NXN863BM02600,OSGB36,380744.36,345461.41,5.69,not owned by a public authority,yes,permissioned,full planning permission,2016-04-05,https://publicaccess.newcastle-staffs.gov.uk/online-applications/applicationDetails.do?keyVal=NXN863BM02600&activeTab=summary,,83,"Proposed student accommodation with carparking (Barnes, Keele Campus) and proposed residential development of 83 dwellings with school drop off point, shop and areas of greenspace (The Hawthorns, Keele Village).",,,,,,,15/01004/FUL ,2017-12-18,2017-12-18
http://opendatacommunities.org/id/district-council/newcastle-staffs,Newcastle-under-Lyme Borough Council,KS19,,"Land at junction of Church Street and Chapel Street, Silverdale",https://publicaccess.newcastle-staffs.gov.uk/online-applications/applicationDetails.do?activeTab=map&keyVal=O1WRHBBMJ3D00,OSGB36,382025.88,346635.15,0.12,not owned by a public authority,yes,permissioned,full planning permission,2016-03-30,https://publicaccess.newcastle-staffs.gov.uk/online-applications/applicationDetails.do?keyVal=O1WRHBBMJ3D00&activeTab=summary,,6,Proposed housing development of 6 dwellings,,,,,,,16/00088/FUL,2017-12-18,2017-12-18
http://opendatacommunities.org/id/district-council/newcastle-staffs,Newcastle-under-Lyme Borough Council,KS21,,"Chapel Court, Chapel Street, Silverdale",https://publicaccess.newcastle-staffs.gov.uk/online-applications/applicationDetails.do?activeTab=map&keyVal=N8RB31BM4V000,OSGB36,382064.51,346524.52,0.28,not owned by a public authority,yes,permissioned,full planning permission,2014-09-19,https://publicaccess.newcastle-staffs.gov.uk/online-applications/applicationDetails.do?keyVal=N8RB31BM4V000&activeTab=summary,,6,Erection of 4 houses and 2 flats and associated external works.,,,,,,,14/00531/FUL  ,2017-12-18,2017-12-18
http://opendatacommunities.org/id/district-council/newcastle-staffs,Newcastle-under-Lyme Borough Council,LW12,,"Tadgedale Quarry, Mucklestone Road, Loggerheads",https://publicaccess.newcastle-staffs.gov.uk/online-applications/applicationDetails.do?activeTab=map&keyVal=NHY8TYBMKD200,OSGB36,373288.61,336510.40,1.14,not owned by a public authority,yes,permissioned,outline planning permission,2017-03-22,https://publicaccess.newcastle-staffs.gov.uk/online-applications/applicationDetails.do?activeTab=summary&keyVal=NHY8TYBMKD200,,128,Erection of up to 128 dwellings ,,,,,,,15/00015/OUT - Site consists of brownfield and greenfield land amounting to 5.84 hectares. The site area provided in column J  is an indication of the brownfiled land area only. ,2017-12-18,2017-12-18
http://opendatacommunities.org/id/district-council/newcastle-staffs,Newcastle-under-Lyme Borough Council,LW36,,Land Adjacent The Sheet Anchor Newcastle Road Whitmore ST5 5BU,https://publicaccess.newcastle-staffs.gov.uk/online-applications/applicationDetails.do?activeTab=map&keyVal=OANVPWBMITT00,OSGB36,379620.19,340444.30,0.48,not owned by a public authority,yes,permissioned,full planning permission,2016-12-16,https://publicaccess.newcastle-staffs.gov.uk/online-applications/applicationDetails.do?activeTab=summary&keyVal=OANVPWBMITT00,,7,The construction of 7 new houses with access road and associated landscaping,,,,,,,16/00609/FUL ,2017-12-18,2017-12-18
http://opendatacommunities.org/id/district-council/newcastle-staffs,Newcastle-under-Lyme Borough Council,RC1,,"Land at Heathcote St, Kidsgrove",https://publicaccess.newcastle-staffs.gov.uk/online-applications/applicationDetails.do?activeTab=map&keyVal=OSCVPKBMLB800,OSGB36,384152.74,354531.83,0.27,not owned by a public authority,yes,permissioned,full planning permission,2017-11-10,https://publicaccess.newcastle-staffs.gov.uk/online-applications/applicationDetails.do?activeTab=summary&keyVal=OSCVPKBMLB800,,14,Demolition of existing building and erection of 14 dwellinghouses,,,,,,,17/00552/FUL,2017-12-18,2017-12-18
http://opendatacommunities.org/id/district-council/newcastle-staffs,Newcastle-under-Lyme Borough Council,SP15,,"Former Site Of Silverdale Station, Station Road, Silverdale",https://publicaccess.newcastle-staffs.gov.uk/online-applications/applicationDetails.do?activeTab=map&keyVal=LLNJ0UBM4V000,OSGB36,381575.32,346649.12,0.62,not owned by a public authority,yes,permissioned,full planning permission,2013-02-18,https://publicaccess.newcastle-staffs.gov.uk/online-applications/applicationDetails.do?activeTab=summary&keyVal=LLNJ0UBM4V000,,23,Erection of twenty three houses,,,,,,,11/00284/FUL,2017-12-18,2017-12-18
http://opendatacommunities.org/id/district-council/newcastle-staffs,Newcastle-under-Lyme Borough Council,TB22,,"35 Higherland, Newcastle",https://publicaccess.newcastle-staffs.gov.uk/online-applications/applicationDetails.do?activeTab=map&keyVal=O72N0PBMJZ900,OSGB36,384342.52,345581.69,0.2,not owned by a public authority,yes,permissioned,full planning permission,2016-09-15,https://publicaccess.newcastle-staffs.gov.uk/online-applications/applicationDetails.do?activeTab=summary&keyVal=O72N0PBMJZ900,,12,"Application for the approval of the details of appearance, the internal access arrangement, the layout and scale of the development, and the landscaping of the site relating to 15/00077/OUT - Erection of up to 12 dwellings. ",,,,,,,16/00405/REM,2017-12-18,2017-12-18
http://opendatacommunities.org/id/district-council/newcastle-staffs,Newcastle-under-Lyme Borough Council,TC17,,"Centurian House, West Street, Newcastle",https://publicaccess.newcastle-staffs.gov.uk/online-applications/applicationDetails.do?activeTab=map&keyVal=NRXT2EBMFNL00,OSGB36,385165.99,345941.19,0.02,not owned by a public authority,yes,permissioned,full planning permission,2015-10-06,https://publicaccess.newcastle-staffs.gov.uk/online-applications/applicationDetails.do?activeTab=summary&keyVal=NRXT2EBMFNL00,,6,Development for 6 no. residential 2 bed properties and ground floor office with storage area ,Ground floor office and storage area (180sqm) ,,,,,,15/00652/FUL,2017-12-18,2017-12-18
http://opendatacommunities.org/id/district-council/newcastle-staffs,Newcastle-under-Lyme Borough Council,TC26,,"London Rd, Newcastle (former Bristol St Motors)",https://publicaccess.newcastle-staffs.gov.uk/online-applications/applicationDetails.do?activeTab=map&keyVal=OILIFRBMI6Y00,OSGB36,385203.63,345384.45,1.41,not owned by a public authority,yes,permissioned,full planning permission,2017-10-30,https://publicaccess.newcastle-staffs.gov.uk/online-applications/applicationDetails.do?activeTab=summary&keyVal=OILIFRBMI6Y00,,499,Redevelopment of the site for 499 apartments (comprising of student accommodation),,,,,,,16/01106/FUL - student accommodation,2017-12-18,2017-12-18
http://opendatacommunities.org/id/district-council/newcastle-staffs,Newcastle-under-Lyme Borough Council,TC32,,"Newcastle Baptist Church, London Road, Newcastle",https://publicaccess.newcastle-staffs.gov.uk/online-applications/applicationDetails.do?activeTab=map&keyVal=N7MNLEBM4V000,OSGB36,385158.72,345618.39,0.09,not owned by a public authority,yes,permissioned,full planning permission,2015-10-26,https://publicaccess.newcastle-staffs.gov.uk/online-applications/applicationDetails.do?keyVal=N7MNLEBM4V000&activeTab=summary,,22,"Demolition of former Newcastle Baptist Church and erection of residential apartment development containing 14 no. 2 bed units and 8 no. 1 bed units, formation of new access and associated car parking ",,,,,,,14/00477/FUL ,2017-12-18,2017-12-18
http://opendatacommunities.org/id/district-council/newcastle-staffs,Newcastle-under-Lyme Borough Council,TK12,,"Chester Road (former Talke Library), Talke",https://www.newcastle-staffs.gov.uk/sites/default/files/IMCE/Planning/Planning_Policy/NonLocal/TK12.pdf,OSGB36,382934.13,353013.48,0.11,not owned by a public authority,yes,not permissioned,,,,,5,,,,,,,,,2017-12-18,2017-12-18
http://opendatacommunities.org/id/district-council/newcastle-staffs,Newcastle-under-Lyme Borough Council,TK22,,"Former Talke Social Club, Coal Pit Hill, Talke",https://publicaccess.newcastle-staffs.gov.uk/online-applications/applicationDetails.do?activeTab=map&keyVal=JUHD8XBM06500,OSGB36,382535.15,353363.81,0.03,not owned by a public authority,yes,permissioned,full planning permission,2008-02-29,https://publicaccess.newcastle-staffs.gov.uk/online-applications/applicationDetails.do?activeTab=summary&keyVal=JUHD8XBM06500,,5,Amendment to approved scheme of residential development for plots 4 and 5 ,,,,,,,08/00014/FUL,2017-12-18,2017-12-18
http://opendatacommunities.org/id/district-council/newcastle-staffs,Newcastle-under-Lyme Borough Council,WL15,,"Priory Day Centre, Lymewood Grove, Newcastle",https://publicaccess.newcastle-staffs.gov.uk/online-applications/applicationDetails.do?activeTab=map&keyVal=N4FSTHBM4V000,OSGB36,384670.79,345540.72,0.66,not owned by a public authority,yes,permissioned,full planning permission,2014-08-29,https://publicaccess.newcastle-staffs.gov.uk/online-applications/applicationDetails.do?activeTab=summary&keyVal=N4FSTHBM4V000,,13,Demolition of the redundant day care centre and the construction of 13 new single storey dwellings ,,,,,,,14/00284/FUL,2017-12-18,2017-12-18
